"Story","Title","Result","Date","Stability","Duration (s)"
"Deleting todos","Should be able to delete todos","SUCCESS","2022-03-17T19:26:15.704313865Z[Etc/UTC]","0.0","1.19"
"Deleting todos","Should see deleting a todo decreases the remaining items count","SUCCESS","2022-03-17T19:26:17.009504026Z[Etc/UTC]","0.0","1.22"
"Deleting todos","Delete an active item","SUCCESS","2022-03-17T19:24:59.565357099Z[Etc/UTC]","0.0","1.34"
"Deleting todos","Delete all the items","SUCCESS","2022-03-17T19:25:01.021717615Z[Etc/UTC]","0.0","3.65"
"Deleting todos","Should be able to delete todos with page objects","SUCCESS","2022-03-17T19:25:44.122894665Z[Etc/UTC]","0.0","1.2"
"Deleting todos","Should see deleting a todo decreases the remaining items count with page objects","SUCCESS","2022-03-17T19:25:45.431620954Z[Etc/UTC]","0.0","1.19"
