"Story","Title","Result","Date","Stability","Duration (s)"
"Deleting todos","Should be able to delete todos","SUCCESS","2022-03-17T22:39:01.75186964Z[Etc/UTC]","0.0","1.09"
"Deleting todos","Should see deleting a todo decreases the remaining items count","SUCCESS","2022-03-17T22:39:02.94930232Z[Etc/UTC]","0.0","1.14"
"Deleting todos","Delete an active item","SUCCESS","2022-03-17T22:37:50.167318479Z[Etc/UTC]","0.0","1.22"
"Deleting todos","Delete all the items","SUCCESS","2022-03-17T22:37:51.507168699Z[Etc/UTC]","0.0","3.62"
"Deleting todos","Should be able to delete todos with page objects","SUCCESS","2022-03-17T22:38:30.997173705Z[Etc/UTC]","0.0","1.13"
"Deleting todos","Should see deleting a todo decreases the remaining items count with page objects","SUCCESS","2022-03-17T22:38:32.233812395Z[Etc/UTC]","0.0","1.13"
