"Story","Title","Result","Date","Stability","Duration (s)"
"Filtering todos","Should be able to view only incomplete todos","SUCCESS","2022-03-17T19:26:10.355036683Z[Etc/UTC]","0.0","1.59"
"Filtering todos","Should be able to view only completed todos","SUCCESS","2022-03-17T19:26:12.052946004Z[Etc/UTC]","0.0","1.56"
"Filtering todos","Should be able to view both complete and incomplete todos","SUCCESS","2022-03-17T19:26:13.716026369Z[Etc/UTC]","0.0","1.74"
"Clear completed todos","Should not be able to clear completed todos if none are complete","SUCCESS","2022-03-17T19:26:21.286762503Z[Etc/UTC]","0.0","1.11"
"Clear completed todos","Should be able to clear completed todos","SUCCESS","2022-03-17T19:26:22.497175955Z[Etc/UTC]","0.0","1.47"
"Complete a todo","Should be able to complete a todo with page objects","SUCCESS","2022-03-17T19:25:37.452243905Z[Etc/UTC]","0.0","1.35"
"Add new todos","Test to resolve issue #616172","SUCCESS","2022-03-17T19:25:20.244660411Z[Etc/UTC]","0.0","1.81"
"Add new todos","Should be able to add additional todo items with page objects","SUCCESS","2022-03-17T19:25:22.208419993Z[Etc/UTC]","0.0","1.43"
