"Story","Title","Result","Date","Stability","Duration (s)"
"Filtering todos","Should be able to view only incomplete todos","SUCCESS","2022-03-17T22:38:56.793800991Z[Etc/UTC]","0.0","1.45"
"Filtering todos","Should be able to view only completed todos","SUCCESS","2022-03-17T22:38:58.352126202Z[Etc/UTC]","0.0","1.46"
"Filtering todos","Should be able to view both complete and incomplete todos","SUCCESS","2022-03-17T22:38:59.914364317Z[Etc/UTC]","0.0","1.63"
"Filtering todos","View only the completed items","SUCCESS","2022-03-17T22:37:55.238594132Z[Etc/UTC]","0.0","1.41"
"Filtering todos","Viewing the items by status","SUCCESS","2022-03-17T22:37:56.765334582Z[Etc/UTC]","0.0","3.93"
"Filtering todos","Should be able to view both complete and incomplete todos with page objects","SUCCESS","2022-03-17T22:38:26.205162522Z[Etc/UTC]","0.0","1.49"
"Filtering todos","Should be able to view only completed todos with page objects","SUCCESS","2022-03-17T22:38:27.802203216Z[Etc/UTC]","0.0","1.41"
"Filtering todos","Should be able to view only incomplete todos with page objects","SUCCESS","2022-03-17T22:38:29.316525582Z[Etc/UTC]","0.0","1.49"
