"Story","Title","Result","Date","Stability","Duration (s)"
"Filtering todos","Should be able to view only incomplete todos","SUCCESS","2022-03-17T20:28:39.829169122Z[Etc/UTC]","0.0","1.49"
"Filtering todos","Should be able to view only completed todos","SUCCESS","2022-03-17T20:28:41.425780075Z[Etc/UTC]","0.0","1.47"
"Filtering todos","Should be able to view both complete and incomplete todos","SUCCESS","2022-03-17T20:28:42.997924357Z[Etc/UTC]","0.0","1.6"
"Filtering todos","View only the completed items","SUCCESS","2022-03-17T20:27:37.460648935Z[Etc/UTC]","0.0","1.54"
"Filtering todos","Viewing the items by status","SUCCESS","2022-03-17T20:27:39.110031475Z[Etc/UTC]","0.0","4.3"
"Filtering todos","Should be able to view both complete and incomplete todos with page objects","SUCCESS","2022-03-17T20:28:09.335268374Z[Etc/UTC]","0.0","1.53"
"Filtering todos","Should be able to view only completed todos with page objects","SUCCESS","2022-03-17T20:28:10.975708872Z[Etc/UTC]","0.0","1.46"
"Filtering todos","Should be able to view only incomplete todos with page objects","SUCCESS","2022-03-17T20:28:12.555582894Z[Etc/UTC]","0.0","1.43"
