"Story","Title","Result","Date","Stability","Duration (s)"
"Filtering todos","Should be able to view only incomplete todos","SUCCESS","2022-03-17T20:20:34.665391005Z[Etc/UTC]","0.0","1.38"
"Filtering todos","Should be able to view only completed todos","SUCCESS","2022-03-17T20:20:36.14748349Z[Etc/UTC]","0.0","1.34"
"Filtering todos","Should be able to view both complete and incomplete todos","SUCCESS","2022-03-17T20:20:37.594481735Z[Etc/UTC]","0.0","1.5"
"Clear completed todos","Should not be able to clear completed todos if none are complete","SUCCESS","2022-03-17T20:20:44.102847716Z[Etc/UTC]","0.0","0.99"
"Clear completed todos","Should be able to clear completed todos","SUCCESS","2022-03-17T20:20:45.198882547Z[Etc/UTC]","0.0","1.25"
"Complete a todo","Should be able to complete a todo with page objects","SUCCESS","2022-03-17T20:20:03.477866679Z[Etc/UTC]","0.0","1.23"
"Add new todos","Test to resolve issue #616172","SUCCESS","2022-03-17T20:19:47.885754932Z[Etc/UTC]","0.0","1.76"
"Add new todos","Should be able to add additional todo items with page objects","SUCCESS","2022-03-17T20:19:49.80169247Z[Etc/UTC]","0.0","1.29"
