"Story","Title","Result","Date","Stability","Duration (s)"
"Filtering todos","Should be able to view only incomplete todos","SUCCESS","2022-03-17T22:44:22.008682437Z[Etc/UTC]","0.0","1.33"
"Filtering todos","Should be able to view only completed todos","SUCCESS","2022-03-17T22:44:23.445344045Z[Etc/UTC]","0.0","1.4"
"Filtering todos","Should be able to view both complete and incomplete todos","SUCCESS","2022-03-17T22:44:24.947450596Z[Etc/UTC]","0.0","1.51"
"Clear completed todos","Should not be able to clear completed todos if none are complete","SUCCESS","2022-03-17T22:44:31.619900212Z[Etc/UTC]","0.0","0.97"
"Clear completed todos","Should be able to clear completed todos","SUCCESS","2022-03-17T22:44:32.700532573Z[Etc/UTC]","0.0","1.29"
"Complete a todo","Should be able to complete a todo with page objects","SUCCESS","2022-03-17T22:43:51.757080587Z[Etc/UTC]","0.0","1.24"
"Add new todos","Test to resolve issue #616172","SUCCESS","2022-03-17T22:43:36.511786834Z[Etc/UTC]","0.0","1.5"
"Add new todos","Should be able to add additional todo items with page objects","SUCCESS","2022-03-17T22:43:38.170122257Z[Etc/UTC]","0.0","1.23"
