"Story","Title","Result","Date","Stability","Duration (s)"
"Filtering todos","Should be able to view only incomplete todos","SUCCESS","2022-03-17T20:28:39.829169122Z[Etc/UTC]","0.0","1.49"
"Filtering todos","Should be able to view only completed todos","SUCCESS","2022-03-17T20:28:41.425780075Z[Etc/UTC]","0.0","1.47"
"Filtering todos","Should be able to view both complete and incomplete todos","SUCCESS","2022-03-17T20:28:42.997924357Z[Etc/UTC]","0.0","1.6"
"Clear completed todos","Should not be able to clear completed todos if none are complete","SUCCESS","2022-03-17T20:28:50.024970312Z[Etc/UTC]","0.0","1.05"
"Clear completed todos","Should be able to clear completed todos","SUCCESS","2022-03-17T20:28:51.175484083Z[Etc/UTC]","0.0","1.34"
"Complete a todo","Should be able to complete a todo with page objects","SUCCESS","2022-03-17T20:28:07.911313078Z[Etc/UTC]","0.0","1.29"
"Add new todos","Test to resolve issue #616172","SUCCESS","2022-03-17T20:27:51.746312288Z[Etc/UTC]","0.0","1.8"
"Add new todos","Should be able to add additional todo items with page objects","SUCCESS","2022-03-17T20:27:53.720204803Z[Etc/UTC]","0.0","1.29"
