"Story","Title","Result","Date","Stability","Duration (s)"
"Completing todos","Mark a task as completed","SUCCESS","2022-03-17T20:28:44.123530896Z[Etc/UTC]","0.0","8.06"
"Completing todos","List of completed items should be empty if nothing has been completed","SUCCESS","2022-03-17T20:28:52.426652087Z[Etc/UTC]","0.0","3.34"
"Deleting todos","Delete an active item","SUCCESS","2022-03-17T20:28:55.882954679Z[Etc/UTC]","0.0","1.21"
"Deleting todos","Delete all the items","SUCCESS","2022-03-17T20:28:57.212370831Z[Etc/UTC]","0.0","3.32"
"Filtering todos","View only the completed items","SUCCESS","2022-03-17T20:29:00.646861621Z[Etc/UTC]","0.0","1.39"
"Filtering todos","Viewing the items by status","SUCCESS","2022-03-17T20:29:02.158438208Z[Etc/UTC]","0.0","3.92"
"Add new todos","Adding an item to an empty list in Cucumber","SUCCESS","2022-03-17T20:29:06.181905772Z[Etc/UTC]","0.0","0.86"
"Add new todos","Adding an item to a list with other items in Cucumber","SUCCESS","2022-03-17T20:29:07.147841685Z[Etc/UTC]","0.0","1.2"
"Add new todos","Adding items to several peoples lists in Cucumber","SUCCESS","2022-03-17T20:29:08.459017046Z[Etc/UTC]","0.0","2.32"
