"Story","Title","Result","Date","Stability","Duration (s)"
"Filtering todos","Should be able to view only incomplete todos","SUCCESS","2022-03-17T20:29:59.084607962Z[Etc/UTC]","0.0","1.35"
"Filtering todos","Should be able to view only completed todos","SUCCESS","2022-03-17T20:30:00.541918758Z[Etc/UTC]","0.0","1.34"
"Filtering todos","Should be able to view both complete and incomplete todos","SUCCESS","2022-03-17T20:30:01.990960445Z[Etc/UTC]","0.0","1.52"
"Filtering todos","View only the completed items","SUCCESS","2022-03-17T20:29:00.646861621Z[Etc/UTC]","0.0","1.39"
"Filtering todos","Viewing the items by status","SUCCESS","2022-03-17T20:29:02.158438208Z[Etc/UTC]","0.0","3.92"
"Filtering todos","Should be able to view both complete and incomplete todos with page objects","SUCCESS","2022-03-17T20:29:30.142256273Z[Etc/UTC]","0.0","1.43"
"Filtering todos","Should be able to view only completed todos with page objects","SUCCESS","2022-03-17T20:29:31.672868553Z[Etc/UTC]","0.0","1.34"
"Filtering todos","Should be able to view only incomplete todos with page objects","SUCCESS","2022-03-17T20:29:33.121148423Z[Etc/UTC]","0.0","1.31"
