"Story","Title","Result","Date","Stability","Duration (s)"
"Add new todos","Test to resolve issue #616172","SUCCESS","2022-03-17T20:27:51.746312288Z[Etc/UTC]","0.0","1.8"
"Add new todos","Should be able to add additional todo items with page objects","SUCCESS","2022-03-17T20:27:53.720204803Z[Etc/UTC]","0.0","1.29"
"Add new todos","Should be able to add additional todo items","SUCCESS","2022-03-17T20:28:20.428116377Z[Etc/UTC]","0.0","1.34"
"Add new todos","Adding an item to a list with other items in Cucumber","SUCCESS","2022-03-17T20:27:44.550243022Z[Etc/UTC]","0.0","1.34"
"Add new todos","Adding items to several peoples lists in Cucumber","SUCCESS","2022-03-17T20:27:46.007129358Z[Etc/UTC]","0.0","2.68"
